"page","term","title","authors","year","n_citations","abstract"
1,"miR-18a","The multifunctional RNA-binding protein hnRNP A1 is required for processing of miR-18a","S Guil, JF Cáceres","2007",706,"… activity with pri-miR-18a and also show reduced abundances of endogenous pre-miR-18a. 
Furthermore, we show that hnRNP A1 is required for miR-18a–mediated repression of a …"
1,"miR-18a","The miR-18a* microRNA functions as a potential tumor suppressor by targeting on K-Ras","WP Tsang, TT Kwok","2009",253,"… expression of miR-18a* by transfection with miR-18a* precursor … upon miR-18a* repression 
was, however, rendered by the Ras inhibitor farnesylthiosalicylic acid. In conclusion, miR-18a…"
2,"miR-18a","miR-18a induces myotubes atrophy by down-regulating IgfI","C Liu, M Wang, M Chen, K Zhang, L Gu, Q Li","2017",42,"… An analysis of miR-18a targets reveals that Igf1 is regulated by miR-18a. miR-18a suppresses 
the expression of … An analysis of miR-18a targets reveals that Igf1 is regulated by miR-18a. …"
2,"miR-18a","[HTML][HTML] miR-18a impairs DNA damage response through downregulation of ataxia telangiectasia mutated (ATM) kinase","L Song, C Lin, Z Wu, H Gong, Y Zeng, J Wu, M Li, J Li","2011",161,"… of miR-18a. Furthermore, we demonstrated that overexpression of miR-18a downregulated 
… Taken together, these results suggest that miR-18a plays an important role in the regulation …"
2,"miR-18a","A distinct inhibitory function for miR-18a in Th17 cell differentiation","MM Montoya, J Maul, PB Singh, HH Pua","2017",52,"… and critical role for miR-18a in limiting Th17 cell differentiation. miR-18a was the most … 
In this study, we uncovered a unique role for miR-18a as a highly inducible inhibitor of Th17 …"
3,"miR-18a","Triple-negative and luminal A breast tumors: differential expression of miR-18a-5p, miR-17-5p, and miR-20a-5p","CMC Calvano Filho, DC Calvano-Mendes","2014",90,"… For example, in our study, miR-18a-5p was overexpressed in tumors … However, previous 
studies reported that miR-18a was … as regulators of estrogen receptor alpha: miR-18a, miR-18b, …"
3,"miR-18a","[HTML][HTML] Identification of miR-18a-5p as an oncogene and prognostic biomarker in RCC","L Zhou, Z Li, X Pan, Y Lai, J Quan, L Zhao","2018",45,"… However, the research of miR-18a-5p in RCC had not been reported yet. Therefore, the … 
detect the expression of miR-18a-5p in RCC tissues and cells and the effects of miR-18a-5p on …"
3,"miR-18a","Stimulation of pri-miR-18a processing by hnRNP A1","G Michlewski, S Guil, JF Cáceres","2010",57,"… is required for the processing of miR-18a at the nuclear step of … the processing of pri-miR-18a 
by binding to its terminal loop … A1-binding to the pri-miR-18a with an unusual phylogenetic …"
3,"miR-18a","Expression of miR‐18a and miR‐34c in circulating monocytes associated with vulnerability to type 2 diabetes mellitus and insulin resistance","SS Wang, YQ Li, YZ Liang, J Dong, Y He","2017",46,"… cells and that high expression of miR-18a was present in Fischer 344 … We predict that miR-18a 
and miR-34c may involve in a … between T2DM and expression of miR-18a and miR-34c in …"
3,"miR-18a","Upregulation of miR-18a-5p contributes to epidermal necrolysis in severe drug eruptions","A Ichihara, Z Wang, M Jinnin, Y Izuno","2014",68,"… Our results indicated that downregulated BCL2L10 caused by miR-18a-5p overexpression 
mediates intrinsic keratinocyte apoptosis in patients with TEN. Serum miR-18a-5p levels can …"
4,"miR-18a","lncRNA PFAL promotes lung fibrosis through CTGF by competitively binding miR‐18a","X Li, T Yu, H Shan, H Jiang, J Sun, X Zhao","2018",54,"… miR-18a, whereas silencing of PFAL had the opposite effect. Furthermore, we found that miR-18a … and miR-18a, we constructed a miR-18a sensor luciferase vector containing a perfect …"
5,"miR-18a","MiR-18a-5p inhibits endothelial–mesenchymal transition and cardiac fibrosis through the Notch2 pathway","H Geng, J Guan","2017",67,"… We report that miR-18a-5p is reduced in HG-treated HAVECs, and overexpression of miR-18a… 
which Notch2 was regulated by miR-18a-5p and determine the role of miR-18a-5p/Notch2 …"
5,"miR-18a","[HTML][HTML] miR-18a-5p MicroRNA increases vascular smooth muscle cell differentiation by downregulating syndecan4","HJ Kee, GR Kim, SN Cho, JS Kwon, Y Ahn","2014",51,"… Considering the effect of VSMC differentiation by miR-18a-5p, we hypothesized that miR-18a-5p 
must downregulate anti-differentiation genes. Among several genes, we found that …"
5,"miR-18a","[HTML][HTML] miR-18a-5p inhibits sub-pleural pulmonary fibrosis by targeting TGF-β receptor II","Q Zhang, H Ye, F Xiang, LJ Song, LL Zhou, PC Cai","2017",61,"… found that miR-18a-5p was reduced in PMCs treated with bleomycin and that downregulation 
of miR-18a-5p contributed to EMT of PMCs. Furthermore, we determined that miR-18a-5p …"
5,"miR-18a","[HTML][HTML] The long noncoding RNA GAS5 negatively regulates the adipogenic differentiation of MSCs by modulating the miR-18a/CTGF axis as a ceRNA","M Li, Z Xie, P Wang, J Li, W Liu, S Tang, Z Liu","2018",72,"… ceRNA) to sponge miR-18a, which promotes adipogenic differentiation. Mutation of the 
binding sites for GAS5 in miR-18a abolished the effect of the interaction. The miR-18a mimic and …"
5,"miR-18a","Berberine blocks inflammasome activation and alleviates diabetic cardiomyopathy via the miR‑18a‑3p/Gsdmd pathway","L Yang, CF Cheng, ZF Li","2023",10,"… suggested to be exerted by the upregulation of miR-18a-3p expression. In addition, the … miR-18a-3p on Gsdmd in vivo and in vitro. Moreover, BBR promotes the activation of the miR-18a…"
6,"miR-18a","miR-18a inhibits BMP4 and HIF-1α normalizing brain arteriovenous malformations","NI Marín-Ramos, TZ Thein, KB Ghaghada","2020",21,"… by which miR-18a … miR-18a normalized the brain vasculature and restored the compromised 
functionality of the bone marrow, lungs, spleen, and livers. Hence, we propose that miR-18a …"
6,"miR-18a","Argonaute‐2 promotes miR‐18a entry in human brain endothelial cells","R Ferreira, T Santos, A Amar, A Gong","2014",39,"… miR‐18a ameliorates the abnormal characteristics of AVM ‐derived brain endothelial cells ( 
… Hence, our aim was to identify the mechanisms by which miR‐18a is internalized by AVM ‐ …"
7,"miR-18a","miR‐18a promotes Mycobacterial survival in macrophages via inhibiting autophagy by down‐regulation of ATM","Q Yuan, H Chen, Y Yang, Y Fu","2020",31,"… miR-18a in autophagy, we examined the impact of miR-18a on expression of autophagic 
protein LC3. Underexpression of miR-18a … , which suggests that miR-18a negatively regulates …"
7,"miR-18a","ACE2‐EPC‐EXs protect ageing ECs against hypoxia/reoxygenation‐induced injury through the miR‐18a/Nox2/ROS pathway","C Zhang, J Wang, X Ma, W Wang","2018",63,"… -EX co-culture increased the level of ACE2 and miR-18a in ECs … miR-18a can transfer its 
cargoes to ECs, we performed quantitative RT-PCR to detect the level of ACE2 and miR-18a in …"
7,"miR-18a","MiR-18a increased the permeability of BTB via RUNX1 mediated down-regulation of ZO-1, occludin and claudin-5","YS Miao, YY Zhao, LN Zhao, P Wang, YH Liu, J Ma","2015",55,"… a target gene of miR-18a. Meanwhile, mRNA and protein expressions and distribution of 
RUNX1 were downregulated by miR-18a. Most important, miR-18a and RUNX1 could reversely …"
7,"miR-18a","IDO1 impairs NK cell cytotoxicity by decreasing NKG2D/NKG2DLs via promoting miR-18a","J Zhang, X Han, X Hu, F Jin, Z Gao, L Yin, J Qin","2018",33,"… Based on computational predictions, miR-18a, which has … of miR-18a and promote the 
downregulation effect of miR-18a … IDO1 promoted the combination of miR-18a and AGO2 after …"
8,"miR-18a","[HTML][HTML] miR-18a increases insulin sensitivity by inhibiting PTEN","Y Zhou, R Wu, H Su, K Li, C Chen, R Xie","2021",9,"… -L1 preadipocytes and C2C12 myoblasts with miR-18a mimics or inhibitors (‘anti-miR-18a’). 
The upregulation and inhibition of miR-18a expression in these cells was confirmed using …"
8,"miR-18a","Diagnostic and Prognostic Significance of serum miR-18a-5p in Patients with Atherosclerosis","PP Teng, Y Liu, M Zhang, W Ji","2021",8,"… miR-18a-5p in AS patients, and explored its clinical values. 110 AS patients and 68 healthy 
controls were collected clinically, and the expression pattern of miR-18a-… MiR-18a-5p was at …"
9,"miR-18a","The MicroRNA, miR‐18a, Regulates NeuroD and Photoreceptor Differentiation in the Retina of Zebrafish","SM Taylor, E Giuffre, P Moseley","2019",22,"… -miR-18a and TaqMan qPCR for mature miR-18a. The results showed that the levels of both 
mature pre-miR-18a and miR-18a … pre-miR-18a can be used as a proxy for mature miR-18a …"
9,"miR-18a","Long non‐coding RNA FENDRR restrains the aggressiveness of CRC via regulating miR‐18a‐5p/ING4 axis","SL Yin, F Xiao, YF Liu, H Chen","2020",30,"… The miR-18a-5p levels were also detected in CRC samples and we observed that miR-18a-5p 
was strikingly overregulated in CRC tissue compared to that in paracancerous tissue (…"
9,"miR-18a","Silencing H19 regulated proliferation, invasion, and autophagy in the placenta by targeting miR‐18a‐5p","L Zhang, X Deng, X Shi, X Dong","2019",33,"… The expression of miR-18a-5p was upregulated, but IRF2 expression was downregulated … miR-18a-5pin HTR8 and JEG3 cells. We propose that aberrant regulation of H19/miR-18a-5p-…"
9,"miR-18a","[HTML][HTML] miR-18a contributes to preeclampsia by downregulating Smad2 (full length) and reducing TGF-β signaling","P Xu, Z Li, Y Wang, X Yu, X Shao, Y Li, C Peng","2020",16,"… technology, we examined pri-miR-18a and miR-18a expression levels in the control and 
sPE placentas. The levels of pri-miR-18a and miR-18a were significantly downregulated in the …"
10,"miR-18a","Prognostic significance of serum miR-18a-5p in severe COVID-19 Egyptian patients","RAH Haroun, WH Osman, AM Eessa","2023",1,"… of hsa-mir-18a-5p decreased in … -mir-18a-5p expression level is a good sensitive and 
specific marker. By using bioinformatics tools, our results revealed that the decreased hsa-mir-18a-…"
10,"miR-18a","[HTML][HTML] Long non-coding RNA MEG3 promotes renal tubular epithelial cell pyroptosis by regulating the miR-18a-3p/GSDMD pathway in lipopolysaccharide-induced …","J Deng, W Tan, Q Luo, L Lin, L Zheng","2021",32,"… In order to detect the targeted binding relationships between MEG3 and miR-18a-3P, and 
between miR-18a-3P and GSDMD, we constructed the pMIRGLO-lncMEG3-WT, pMIRGLO-…"
10,"miR-18a","[HTML][HTML] Cortical bone derived stem cells modulate cardiac fibroblast response via miR-18a in the heart after injury","L Kraus, L Ma, Y Yang, F Nguyen, RC Hoy","2020",17,"… treated with CBSCs medium increase miR-18a-5p expression suggesting the ability of 
CBSCs to transfer miR-18a-5p to adult fibroblasts. Moreover, miR-18a-5p expression declines in …"
10,"miR-18a","[HTML][HTML] Leonurine-repressed miR-18a-5p/SOCS5/JAK2/STAT3 axis activity disrupts CML malignancy","HM Liu, CL Guo, YF Zhang, JF Chen","2021",14,"… miR-18a-5p was significantly upregulated and miR-18a-5p repressed SOCS5 expression by 
directly targeting its 3′-UTR in CML cells. Overexpression of miR-18a… relieved miR-18a-5p …"
10,"miR-18a","MiR-18a-5p contributes to enhanced proliferation and migration of PASMCs via targeting Notch2 in pulmonary arterial hypertension","R Miao, W Liu, C Qi, Y Song, Y Zhang, Y Fu, W Liu","2020",16,"… target of miR-18a-5p and was repressed by miR-18a-5p … proliferation and migration 
induced by miR-18a-5p mimics in … and was negatively correlated with miR-18a-5p expression. …"
10,"miR-18a","LncRNA CASC2 is involved in the development of chronic obstructive pulmonary disease via targeting miR-18a-5p/IGF1 axis","P Liu, H Zhang, H Zeng, Y Meng","2021",16,"… indicated that overexpression of miR-18a-5p reduced the level of IGF1, while miR-18a-5p 
downregulation led to the increase of IGF1. Furthermore, a low level of miR-18a-5p was also …"
11,"miR-18a","LncRNA JPX regulates proliferation and apoptosis of nucleus pulposus cells by targeting the miR-18a-5p/HIF-1α/Hippo-YAP pathway","H Yang, G Wang, J Liu, M Lin, J Chen, Y Fang","2021",17,"… verify that lncRNA JPX directly bound to miR-18a-5p and influenced HNPC proliferation and 
… of miR-18a-5p to HIF-1α and demonstrated a negative correlation between miR-18a-5p and …"
12,"miR-18a","[HTML][HTML] Epigenetics in Canine Mammary Tumors: Upregulation of miR-18a and miR-18b Oncogenes Is Associated with Decreased ERS1 Target mRNA Expression …","JM Abbate, F Arfuso, K Riolo, F Capparucci, B Brunetti","2023",2,"… an important target mRNA for miR-18a and miR-18b, … correlation between the expression of miR-18a and miR-18b and their … It is noteworthy that the overexpression of miR-18a and miR-…"
12,"miR-18a","[HTML][HTML] Berberine acts on C/EBPβ/lncRNA Gas5/miR-18a-5p loop to decrease the mitochondrial ROS generation in HK-2 cells","J Xu, L Liu, L Gan, Y Hu, P Xiang, Y Xing","2021",18,"… between Gas5 and miR-18a-5p and between miR-18a-5p and C/… miR-18a-5p expression 
as competing endogenous RNA (ceRNA) and reduce the negative regulatory effect of miR-18a-…"
12,"miR-18a","[HTML][HTML] MiR-18a-3p improves cartilage matrix remodeling and inhibits inflammation in osteoarthritis by suppressing PDP1","X Feng, J Lu, Y Wu, H Xu","2022",6,"… Although miR-18a-3p can … role of miR-18a-3p in cartilage matrix deposition and inflammatory 
response of chondrocytes in OA and investigated the underlying mechanism of miR-18a-3p…"
12,"miR-18a","[HTML][HTML] MiR-18a regulates myoblasts proliferation by targeting Fgf1","C Liu, M Chen, M Wang, W Pi, N Li, Q Meng","2018",10,"… miR-18a participates in modulating proliferation in cultured C2C12 myoblasts, primary myoblasts 
and RD cells. MiR-18a … of miR-18a in vivo, we determined the expression of miR-18a in …"
12,"miR-18a","[HTML][HTML] Long noncoding RNA UCA1 enhances sensitivity to oncolytic vaccinia virus by sponging miR-18a/miR-182 and modulating the Cdc42/filopodia axis in …","K Horita, H Kurosaki, M Nakatake, M Ito, H Kono","2019",20,"… Moreover, expression analysis of various miRNAs suggested that UCA1 inhibits both miR-18a 
and miR-182, thereby promoting Cdc42 activation, which in turn, regulates OVV cell-to-…"
12,"miR-18a","miR-18a-3p encourages apoptosis of chondrocyte in osteoarthritis via HOXA1 pathway","B Ding, S Xu, X Sun, J Gao, W Nie","2020",13,"… ), miR-18a-3p inhibitor, mimic-NC or miR-18a-3p mimic for 72 hours followed by evaluation 
of levels of miR-18a-… B: Results of cell counting kit-8 (CCK-8) showed that miR-18a-3p mimic …"
12,"miR-18a","[HTML][HTML] miR-18a counteracts AKT and ERK activation to inhibit the proliferation of pancreatic progenitor cells","X Li, Z Zhang, Y Li, Y Zhao, W Zhai, L Yang, D Kong","2017",21,"… miR-18a, we analyzed the effect of miR-18a or miR-18a inhibitor on the cell cycle of cultured 
pancreatic progenitor cells. FACs analysis showed that miR-18a … whereas miR-18a inhibitor …"
12,"miR-18a","[HTML][HTML] Upregulated miR-18a-5p in Colony Forming Unit-Hill's in Subclinical Cardiovascular Disease and Metformin Therapy; MERIT Study","J Phowira, FW Ahmed, S Bakhashab, JU Weaver","2022",4,"… In contrast to our finding, another study reported downregulated serum miR-18a in T2DM, 
suggesting that miR-18a might improve insulin sensitivity via inhibition of PTEN, a known …"
13,"miR-18a","Exosomal miR-18a-5p promotes EMT and metastasis of NPC cells via targeting BTG3 and activating the Wnt/β-catenin signaling pathway","Q Zhong, Q Nie, R Wu, Y Huang","2023",2,"… of miR-18a-5p, and BTG3 could overturn the effect of miR-18a-5p on NPC cells. Xenograft 
mouse model of NPC nude mice showed that miR-18a-… revealed that exosomal miR-18a-5p …"
13,"miR-18a","[HTML][HTML] MiR-18a-5p Targets Connective Tissue Growth Factor Expression and Inhibits Transforming Growth Factor β2-Induced Trabecular Meshwork Cell Contractility","J Knox, G Bou-Gharios, KJ Hamill, CE Willoughby","2022",6,"… cells, identifying miR-18a-5p as a consistently upregulated miRNA. We then used miR-18a-5p … 
The results suggest that a therapy based upon miR-18a-5p may hold potential for POAG …"
13,"miR-18a","Regulatory role of miR-18a to CCN2 by TGF-β1 signaling pathway in pulmonary injury induced by nano-SiO2","H Yang, W Li, Y Zhang, M Li, Y Gao, C Lao","2018",19,"… This research is designed to investigate the regulatory effect of miR-18a to the target gene 
… of miR-18a in pulmonary injury induced by nano-SiO 2 based on our early study. miR-18a …"
13,"miR-18a","[HTML][HTML] Resilient Phenotype in Chronic Mild Stress Paradigm Is Associated with Altered Expression Levels of miR-18a-5p and Serotonin 5-HT1a Receptor in Dorsal …","D Zurawek, P Gruca, L Antkiewicz-Michaluk","2019",23,"… decreased expression level of miR-18a-5p and, in the … miR-18a-5p may be a negative 
epigenetic regulator of 5-HT1AR since the treatment of adult hippocampal neurons with miR-18a-…"
13,"miR-18a","[HTML][HTML] Bidirectional regulation of angiogenesis and miR-18a expression by PNS in the mouse model of tumor complicated by myocardial ischemia","Q Yang, X Wang, J Cui, P Wang, M Xiong, C Jia","2014",27,"… in reduced expression of miR-18a in tumor and upregulated expression of miR-18a in heart. 
… in part through modulating the expression of miR-18a, which could be responsible for its …"
13,"miR-18a","Disruption of miR-18a Alters Proliferation, Photoreceptor Replacement Kinetics, Inflammatory Signaling, and Microglia/Macrophage Numbers During Retinal …","E Magner, P Sandoval-Sanchez, AC Kramer","2022",11,"… RT-qPCR, in situ hybridization, and immunohistochemistry showed that miR-18a … miR-18a 
function during photoreceptor regeneration, we used homozygous miR-18a mutants (miR-18a …"
14,"miR-18a","[HTML][HTML] PBMCs to stress-associated miR-18a-5p and miR-22-3p ratios as new indicators of metabolic syndrome","Y Huang, L Zhao, Y Yan, J Chen, P Liu, W Xv","2020",9,"… and that high expression of miR-18a was present in Fischer 344 (… have investigated the 
expressions of miR-18a-5p and miR-… between MetS and expression of miR-18a-5p and miR-22a-…"
14,"miR-18a","[HTML][HTML] lncRNA PART1, manipulated by transcriptional factor FOXP2, suppresses proliferation and invasion in ESCC by regulating the miR‑18a‑5p/SOX6 signaling …","Y Zhao, Q Zhang, H Liu, N Wang","2021",16,"… , miR-18a-5p inhibitor significantly suppressed miR-18a-5p expression in the Eca109 
and EC9706 cell lines (Fig. 5H), whereas miR-18a-5p mimic significantly promoted miR-18a-5p …"
14,"miR-18a","[HTML][HTML] Targeting miR-18a sensitizes chondrocytes to anticytokine therapy to prevent osteoarthritis progression","C Lian, T Tao, P Su, Z Liao, X Wang, Y Lei","2020",8,"… Moreover, we identified up-regulation of miR-18a in injured lesion of OA patients compared 
… of miR-18a and IL-1β in OA injured cartilage, further supporting that miR-18a might …"
14,"miR-18a","[HTML][HTML] LncRNA FENDRR inhibits ox-LDL induced mitochondrial energy metabolism disorder in aortic endothelial cells via miR-18a-5p/PGC-1α signaling pathway","G Wang, Y Yang, H Ma, L Shi, W Jia, X Hao","2021",10,"… In conclusion, this study showed that FENDRR acted as a molecular sponge to adsorb miR-18a-5p in normal HAECs and inhibited the negative regulation of miR-18a-5p on PGC-1α, …"
14,"miR-18a","[HTML][HTML] Neurogenic hypertension mediated mitochondrial abnormality leads to cardiomyopathy: Contribution of UPRmt and norepinephrine-miR-18a-5p-HIF-1α axis","SS Nandi, K Katsurada, SK Mahata","2021",9,"… -5p and HIF-1α we transfected H9c2 cardiomyocytes with miR-18a-5p or anti-miR-18a-5p 
mimic probes to elicit either miRNA gain or loss of function, respectively, and then examined …"
14,"miR-18a","[HTML][HTML] Roles of lncRNA UCA1-miR-18a-SOX6 axis in preventing hypoxia injury following cerebral ischemia","J Tian, H Xu, G Chen, H Wang, Y Bi","2017",17,"… to be a target of miR-18a whose expression could be negatively regulated by miR-18a. An 
… down-regulation of UCA1 promoted the expression of miR-18a that led to a reduction in the …"
14,"miR-18a","[HTML][HTML] Novel role of miR-18a-5p and galanin in rat lung ischemia reperfusion-mediated response","K Xiao, L Song, Y Hu, W He, F Hou, P Yan","2021",6,"… We then validated one of the downregulated miRNAs, miR18a-5p, in the in vitro model of 
IR… Galanin mRNA as a target for miR-18a-5p. Downregulation of miR-18a-5p upon IR leads to …"
15,"miR-18a","Isoflurane alleviates myocardial injury induced by hypoxia/reoxygenation by regulating miR-18a-5p","Y Su, G Chen, F Zhang, L Wang, Z Feng","2021",7,"… Therefore, in this study, the role of miR-18a-5p and ISO in protecting myocardial injury was 
explored by establishing in vitro myocardial hypoxia/reoxygenation cell model to simulate …"
15,"miR-18a","[HTML][HTML] MiR-18a-5p acts as a novel serum biomarker for venous malformation and promotes angiogenesis by regulating the thrombospondin-1/P53 signaling axis","L Zhang, D Wang, Z Wang, X Li, W Xia","2021",6,"… serum miR-18a-5p and validated its function in VM. Notably, higher expression level of miR-18a-5p was detected in VM patients than in healthy individuals. We found that miR-18a-5p …"
15,"miR-18a","[HTML][HTML] MiR-18a Inhibits PI3K/AKT Signaling Pathway to Regulate PDGF-BB-Induced Airway Smooth Muscle Cell Proliferation and Phenotypic Transformation","Y Wei, C Yunbin, C Huang, W Wenjian","2021",7,"… In this study, we focused on the expression of mircoRNA-18a (miR-18a) in airway remodeling 
… To investigate the role of miR-18a in ASMCs, we transfected miR-18a mimics and miR-18a …"
15,"miR-18a","MiR-18a aggravates intracranial hemorrhage by regulating RUNX1-Occludin/ZO-1 axis to increase BBB permeability","S Ren, G Wu, Y Huang, L Wang, Y Li","2021",7,"… of miR-18a through luciferase reporter assay and miR-18a can bind to the 3’-UTR region 
of RUNX1 mRNA to inhibit RUNX1 expression. The overexpression of miR-18a significantly …"
15,"miR-18a","Overexpression of miR‐18a negatively regulates myocyte enhancer factor 2D to increase the permeability of the blood–tumor barrier via Krüppel‐like factor 4 …","YY Zhao, LN Zhao, P Wang, YS Miao","2015",24,"… miR-18a, as an important member of the miR-17–92 cluster, … However, whether miR-18a 
is involved in regulating the … This study investigates the potential roles of miR-18a in the …"
15,"miR-18a","… oxygen–glucose deprivation and reoxygenation (OGD/R)-induced human brain microvascular endothelial cell injury via regulating miR-18a-5p/ACVR2B axis","D Liu, H Xiao, J Liu, Y Zhang, J Li, T Zhang","2023",3,"… could be regulated by miR-18a-5p in ischemic … with miR-18a-5p, and miR-18a-5p could 
bind to the 3’UTR of ACVR2B. Therefore, we speculate that circ_0000566 may regulate miR-18a-…"
15,"miR-18a","[HTML][HTML] Circulating miR-122-5p, miR-92a-3p, and miR-18a-5p as Potential Biomarkers in Human Liver Transplantation Follow-Up","C Morsiani, S Collura, F Sevini, E Ciurca","2023",1,"… In particular, miR-122-5p, miR-92a-3p, and miR-18a-5p revealed the same trend after 
transplantation and an increase in their level was found in patients with complications, …"
16,"miR-18a","MicroRNA miR-18a-3p promotes osteoporosis and possibly contributes to spinal fracture by inhibiting the glutamate AMPA receptor subunit 1 gene (GRIA1)","M Zhao, J Dong, Y Liao, G Lu, W Pan, H Zhou","2022",5,"… targeted correlation between miR-18a-3p and GRIA1. We observed an increase in miR-18a-3p … 
Upregulation of miR-18a-3p restrained the activity and expression of ALP in hBMSCs, …"
16,"miR-18a","[HTML][HTML] … of maternally expressed 3 alleviates hyperoxia-induced lung injury via inhibiting thioredoxin-interacting protein–mediated pyroptosis by binding to miR-18a","DM Zou, SM Zhou, LH Li, JL Zhou, ZM Tang","2020",21,"… C and D: The potential binding sites between MEG3 as well as TXNIP and miR-18a … miR-18a 
and MEG3 or TXNIP. E and F: After cotransfection with miR-18a mimics as well as miR-18a …"
16,"miR-18a","Downregulation of miR-18a induces CTGF and promotes proliferation and migration of sodium hyaluronate treated human corneal epithelial cells","Y Guo, X Lu, H Wang","2016",16,"… Since miR-18a showed predominantly large absolute fold change … miR-18a may be essential 
for promoting wound healing in SH treated cells. To examine the critical role of miR-18a in …"
16,"miR-18a","A miR-18a binding-site polymorphism in CDC42 3′ UTR affects CDC42 mRNA expression in placentas and is associated with litter size in pigs","R Liu, D Deng, X Liu, Y Xiao, J Huang, F Wang, X Li","2019",14,"… In this study, we find that miR-18a and cell division cycle 42 (CDC42… to the miR-18a seed 
could influence miR-18a-related regulation of … These results suggest the miR-18a binding-site …"
17,"miR-18a","Long noncoding RNA CASC2 protect ROS‐induced oxidative stress in myocardial infarction by miR‐18a/SIRT2","G Ying, Z Tang, J Zhang, J Zeng","2022",4,"… MiR-18a mimics increased the expression of miR-18a gene, … MiR-18a siRNA or negative 
siRNA into in vitro model of … we found that miR-18a siRNA reduced miR-18a gene expression, …"
17,"miR-18a","[HTML][HTML] MiR-18a regulates expression of the pancreatic transcription factor Ptf1a in pancreatic progenitor and acinar cells","Y Yang, L Ding, Y An, Z Zhang, Y Lang, S Tai, F Guo","2012",18,"… We also found that miR-18a, another member of miR-17–92 cluster miRNAs, could repress 
… of miR-18a on pancreatic cells remain unclear. In the present study, we show that miR-18a …"
